{
  "schema": "operatebench.clean_tracked_source_tree_golden.v1",
  "schema_version": 1,
  "algorithm": "operatebench.clean_tracked_source_tree.v1",
  "prefix_utf8": "operatebench.clean_tracked_source_tree.v1",
  "prefix_utf8_hex": "6f70657261746562656e63682e636c65616e5f747261636b65645f736f757263655f747265652e7631",
  "separator_byte_hex": "00",
  "enumeration_command": "git ls-tree -r -z --full-tree HEAD",
  "accepted_modes": [
    "100644",
    "100755",
    "120000"
  ],
  "max_path_utf8_bytes": 4096,
  "refusal_codes": [
    "dirty_tracked_content",
    "duplicate_path",
    "frame_length_overflow",
    "mode_observation_unavailable",
    "non_canonical_path",
    "out_of_order",
    "portable_path_collision",
    "staged_index_drift",
    "submodule_entry",
    "unreadable_bytes",
    "unsafe_path",
    "unsupported_mode"
  ],
  "precondition_vectors": [
    {
      "name": "staged_index_drift",
      "description": "`git diff-index --cached --quiet HEAD --` must exit zero; the index is compared with HEAD before the working tree so a staged change is never reported as ordinary dirt.",
      "refusal_code": "staged_index_drift",
      "probe": "git diff-index --cached --quiet HEAD --",
      "order": 1
    },
    {
      "name": "dirty_tracked_content",
      "description": "`git status --porcelain=v1 -z --untracked-files=all` must emit zero bytes; tracked/index/worktree changes and untracked non-ignored paths refuse, while Git continues to exclude ignored paths.",
      "refusal_code": "dirty_tracked_content",
      "probe": "git status --porcelain=v1 -z --untracked-files=all",
      "order": 2
    },
    {
      "name": "mode_observation_unavailable",
      "description": "On POSIX, explicit core.fileMode=false or core.symlinks=false refuses; true and unset use the enabled POSIX Git behavior. Non-POSIX execution refuses.",
      "refusal_code": "mode_observation_unavailable",
      "probe": "git config --get core.fileMode; git config --get core.symlinks",
      "order": 3
    }
  ],
  "accept_vectors": [
    {
      "name": "empty_tree",
      "description": "A clean tree with no tracked entries hashes the domain prefix alone.",
      "entries": [],
      "framed_bytes_hex": "6f70657261746562656e63682e636c65616e5f747261636b65645f736f757263655f747265652e763100",
      "framed_byte_count": 42,
      "expected_sha256": "68f6186b2db6dc772dc66283dfa332d841dcdc93e80a200afe7e2ee725906f43"
    },
    {
      "name": "single_regular_file",
      "description": "One regular blob; framing is fixed mode length, mode, fixed path length, path, fixed blob length, blob.",
      "entries": [
        {
          "mode": "100644",
          "path_hex": "612e747874",
          "content_hex": "68656c6c6f0a"
        }
      ],
      "framed_bytes_hex": "6f70657261746562656e63682e636c65616e5f747261636b65645f736f757263655f747265652e76310000000000000000063130303634340000000000000005612e747874000000000000000668656c6c6f0a",
      "framed_byte_count": 83,
      "expected_sha256": "9f5e2353f8e358207f697ef3315ec2e37d231c30583bb970a9a5970ae0f6e6ee"
    },
    {
      "name": "regular_executable_symlink",
      "description": "All three accepted modes in Git tree order; the symlink contributes its target bytes, not the bytes of the file it points at.",
      "entries": [
        {
          "mode": "100644",
          "path_hex": "524541444d452e6d64",
          "content_hex": "2320666978747572650a"
        },
        {
          "mode": "120000",
          "path_hex": "6c696e6b",
          "content_hex": "524541444d452e6d64"
        },
        {
          "mode": "100755",
          "path_hex": "746f6f6c732f72756e2e7368",
          "content_hex": "23212f62696e2f73680a6578697420300a"
        }
      ],
      "framed_bytes_hex": "6f70657261746562656e63682e636c65616e5f747261636b65645f736f757263655f747265652e76310000000000000000063130303634340000000000000009524541444d452e6d64000000000000000a2320666978747572650a000000000000000631323030303000000000000000046c696e6b0000000000000009524541444d452e6d640000000000000006313030373535000000000000000c746f6f6c732f72756e2e7368000000000000001123212f62696e2f73680a6578697420300a",
      "framed_byte_count": 193,
      "expected_sha256": "a4d1904dbef15f4c3ec14ea347d762afb47ff4a9be84f18f5a984199f671a465"
    },
    {
      "name": "utf8_path_and_empty_blob",
      "description": "A non-ASCII UTF-8 path and a zero-length blob; the fixed eight-byte unsigned big-endian length field is the exact byte count, so a two-byte code point contributes two.",
      "entries": [
        {
          "mode": "100644",
          "path_hex": "636166c3a92e747874",
          "content_hex": "c3a90a"
        },
        {
          "mode": "100644",
          "path_hex": "656d7074792e62696e",
          "content_hex": ""
        }
      ],
      "framed_bytes_hex": "6f70657261746562656e63682e636c65616e5f747261636b65645f736f757263655f747265652e76310000000000000000063130303634340000000000000009636166c3a92e7478740000000000000003c3a90a00000000000000063130303634340000000000000009656d7074792e62696e0000000000000000",
      "framed_byte_count": 123,
      "expected_sha256": "0af448779fdf919bbb51b60126757d87e3da02dbb8e475cbc4c4b27e52565b83"
    },
    {
      "name": "nested_paths_in_git_emission_order",
      "description": "Nested paths in the strictly ascending canonical UTF-8 byte order emitted by `git ls-tree -r -z --full-tree HEAD`; feeding them in another order refuses rather than sorting.",
      "entries": [
        {
          "mode": "100644",
          "path_hex": "7375622e747874",
          "content_hex": "6f757465720a"
        },
        {
          "mode": "100644",
          "path_hex": "7375622f696e6e65722e747874",
          "content_hex": "696e6e65720a"
        }
      ],
      "framed_bytes_hex": "6f70657261746562656e63682e636c65616e5f747261636b65645f736f757263655f747265652e763100000000000000000631303036343400000000000000077375622e74787400000000000000066f757465720a0000000000000006313030363434000000000000000d7375622f696e6e65722e7478740000000000000006696e6e65720a",
      "framed_byte_count": 134,
      "expected_sha256": "e005e38877f3f1f47fd8fcd33cbbb781141bf9997aaaacc16f42ac927e69cf70"
    }
  ],
  "reject_vectors": [
    {
      "name": "submodule_gitlink",
      "description": "A gitlink entry is refused; submodules never participate.",
      "refusal_code": "submodule_entry",
      "entry": {
        "mode": "160000",
        "path_hex": "76656e646f722f646570",
        "content_hex": ""
      }
    },
    {
      "name": "group_writable_regular_mode",
      "description": "Only 100644, 100755 and 120000 are accepted modes.",
      "refusal_code": "unsupported_mode",
      "entry": {
        "mode": "100664",
        "path_hex": "612e747874",
        "content_hex": "61"
      }
    },
    {
      "name": "tree_mode",
      "description": "A tree entry cannot appear under -r and is refused if it does.",
      "refusal_code": "unsupported_mode",
      "entry": {
        "mode": "040000",
        "path_hex": "646972",
        "content_hex": ""
      }
    },
    {
      "name": "empty_path",
      "description": "An empty path is unsafe.",
      "refusal_code": "unsafe_path",
      "entry": {
        "mode": "100644",
        "path_hex": "",
        "content_hex": ""
      }
    },
    {
      "name": "absolute_path",
      "description": "A leading slash is unsafe.",
      "refusal_code": "unsafe_path",
      "entry": {
        "mode": "100644",
        "path_hex": "2f6574632f706173737764",
        "content_hex": ""
      }
    },
    {
      "name": "dot_component",
      "description": "A `.` component is unsafe.",
      "refusal_code": "unsafe_path",
      "entry": {
        "mode": "100644",
        "path_hex": "2e2f612e747874",
        "content_hex": ""
      }
    },
    {
      "name": "dot_dot_component",
      "description": "A `..` component is unsafe.",
      "refusal_code": "unsafe_path",
      "entry": {
        "mode": "100644",
        "path_hex": "612f2e2e2f62",
        "content_hex": ""
      }
    },
    {
      "name": "empty_component",
      "description": "A doubled separator yields an empty component and is unsafe.",
      "refusal_code": "unsafe_path",
      "entry": {
        "mode": "100644",
        "path_hex": "612f2f62",
        "content_hex": ""
      }
    },
    {
      "name": "trailing_separator",
      "description": "A trailing separator yields an empty component and is unsafe.",
      "refusal_code": "unsafe_path",
      "entry": {
        "mode": "100644",
        "path_hex": "612f",
        "content_hex": ""
      }
    },
    {
      "name": "backslash_byte",
      "description": "A backslash is unsafe because it is a separator elsewhere.",
      "refusal_code": "unsafe_path",
      "entry": {
        "mode": "100644",
        "path_hex": "615c62",
        "content_hex": ""
      }
    },
    {
      "name": "control_byte",
      "description": "A byte below 0x20 is unsafe.",
      "refusal_code": "unsafe_path",
      "entry": {
        "mode": "100644",
        "path_hex": "610a62",
        "content_hex": ""
      }
    },
    {
      "name": "delete_byte",
      "description": "The 0x7F byte is unsafe.",
      "refusal_code": "unsafe_path",
      "entry": {
        "mode": "100644",
        "path_hex": "617f62",
        "content_hex": ""
      }
    },
    {
      "name": "git_component_exact",
      "description": "A `.git` component is unsafe.",
      "refusal_code": "unsafe_path",
      "entry": {
        "mode": "100644",
        "path_hex": "2e6769742f636f6e666967",
        "content_hex": ""
      }
    },
    {
      "name": "git_component_case_folded",
      "description": "A case-folded `.git` component is unsafe on any platform.",
      "refusal_code": "unsafe_path",
      "entry": {
        "mode": "100644",
        "path_hex": "612f2e4769542f78",
        "content_hex": ""
      }
    },
    {
      "name": "non_utf8_path_bytes",